{
  "schemaVersion": "2.0.0",
  "id": "stage13.rs-latch",
  "version": 1,
  "title": "لچ RS؛ تنظیم، حفظ و بازنشانی",
  "titleFa": "لچ RS؛ تنظیم، حفظ و بازنشانی",
  "domain": [
    "circuits"
  ],
  "summaryFa": "ورودی S خروجی را یک می‌کند، ورودی R آن را صفر می‌کند و در S=R=0 حالت قبلی حفظ می‌شود.",
  "learningObjectives": [
    "درک حافظه سطحی لچ RS"
  ],
  "prerequisites": [
    "آشنایی با منطق صفر و یک و لبه کلاک"
  ],
  "scene": {
    "schemaVersion": "1.0.0",
    "id": "aria.stage13.rs-latch",
    "title": "لچ RS؛ تنظیم، حفظ و بازنشانی",
    "titleFa": "لچ RS؛ تنظیم، حفظ و بازنشانی",
    "domain": "circuits",
    "simulation": {
      "dt": 0.1,
      "timeScale": 1,
      "gravity": {
        "x": 0,
        "y": 0
      },
      "circuitMode": "digital"
    },
    "parts": [
      {
        "instanceId": "s",
        "partId": "circuits.latching-logic-input",
        "transform": {
          "position": {
            "x": -5,
            "y": 1
          },
          "rotation": 0,
          "scale": {
            "x": 1,
            "y": 1
          }
        },
        "properties": {
          "value": false
        }
      },
      {
        "instanceId": "r",
        "partId": "circuits.latching-logic-input",
        "transform": {
          "position": {
            "x": -5,
            "y": -1
          },
          "rotation": 0,
          "scale": {
            "x": 1,
            "y": 1
          }
        },
        "properties": {
          "value": false
        }
      },
      {
        "instanceId": "latch",
        "partId": "circuits.4043-without-enable",
        "transform": {
          "position": {
            "x": 0,
            "y": 0
          },
          "rotation": 0,
          "scale": {
            "x": 1,
            "y": 1
          }
        },
        "properties": {}
      },
      {
        "instanceId": "q",
        "partId": "circuits.logic-output",
        "transform": {
          "position": {
            "x": 5,
            "y": 1
          },
          "rotation": 0,
          "scale": {
            "x": 1,
            "y": 1
          }
        },
        "properties": {}
      },
      {
        "instanceId": "qbar",
        "partId": "circuits.logic-output",
        "transform": {
          "position": {
            "x": 5,
            "y": -1
          },
          "rotation": 0,
          "scale": {
            "x": 1,
            "y": 1
          }
        },
        "properties": {}
      }
    ],
    "connections": [
      {
        "id": "c1",
        "kind": "electrical",
        "from": {
          "instanceId": "s",
          "portId": "port-1"
        },
        "to": {
          "instanceId": "latch",
          "portId": "s"
        }
      },
      {
        "id": "c2",
        "kind": "electrical",
        "from": {
          "instanceId": "r",
          "portId": "port-1"
        },
        "to": {
          "instanceId": "latch",
          "portId": "r"
        }
      },
      {
        "id": "c3",
        "kind": "electrical",
        "from": {
          "instanceId": "latch",
          "portId": "q"
        },
        "to": {
          "instanceId": "q",
          "portId": "port-1"
        }
      },
      {
        "id": "c4",
        "kind": "electrical",
        "from": {
          "instanceId": "latch",
          "portId": "qbar"
        },
        "to": {
          "instanceId": "qbar",
          "portId": "port-1"
        }
      }
    ],
    "probes": [
      {
        "id": "q-state",
        "instanceId": "q",
        "quantity": "logic",
        "labelFa": "خروجی Q"
      }
    ],
    "metadata": {
      "stage": 13,
      "executionMode": true,
      "circuitMode": "digital",
      "stateful": true
    }
  },
  "guide": {
    "mode": "guided",
    "steps": [
      {
        "id": "observe",
        "titleFa": "وضعیت اولیه",
        "instructionFa": "وضعیت اولیه ورودی‌ها و خروجی را روی برد بررسی کنید.",
        "checks": [
          {
            "type": "runtime-no-error"
          }
        ],
        "hints": [
          {
            "textFa": "خروجی فقط از موتور منطقی آزمایشگاه خوانده می‌شود."
          }
        ]
      },
      {
        "id": "trigger",
        "titleFa": "ایجاد تغییر حالت",
        "instructionFa": "در حالت اجرای آزمایش، ورودی کلاک یا ورودی‌های منطقی را لمس کنید و تغییر حالت را مشاهده کنید.",
        "checks": [
          {
            "type": "runtime-no-error"
          }
        ],
        "hints": [
          {
            "textFa": "در قطعات ترتیبی، حالت قبلی تا رویداد منطقی بعدی حفظ می‌شود."
          }
        ]
      }
    ]
  },
  "measurements": [
    {
      "id": "q-state",
      "labelFa": "خروجی Q",
      "unit": "logic",
      "probe": {
        "id": "q-state",
        "instanceId": "q",
        "quantity": "logic",
        "labelFa": "خروجی Q"
      }
    }
  ],
  "expectedResults": [
    {
      "statementFa": "در حالت S=R=0 مقدار قبلی Q حفظ می‌شود."
    }
  ],
  "assessment": {
    "passThreshold": 0.5,
    "rules": [
      {
        "id": "runtime",
        "type": "runtime-no-error",
        "weight": 1
      }
    ]
  },
  "assistant": {
    "enabled": true,
    "mode": "grounded-coach",
    "guardrails": [
      "حالت فلیپ‌فلاپ یا شمارنده را فقط از Solver بخوان.",
      "هیچ مقدار منطقی را حدس نزن."
    ]
  },
  "metadata": {
    "stage": 13,
    "executionMode": true,
    "statefulDigital": true
  }
}
